<?xml version="1.0" encoding="UTF-8"?>

<list xmlns:xsi="http://www.w3.org/2001/XMLSchema-instance"
	  xmlns="http://l2j.org"
	  xsi:schemaLocation="http://l2j.org xsd/attendance.xsd">

	<item id="29647" count="3" /> <!-- Attendance Coin -->
	<item id="71437"/> <!-- Shining jewel box -->
	<item id="91780" count="3" /> <!-- Battle scroll  -->
	<item id="29566"/> <!-- Attendance XP Rune -->
	<item id="29584" count="3" /> <!-- XP/SP Scroll - Medium -->
	<item id="10649" count="2" /> <!-- Feather of blessing -->
	<item id="90045" count="31" highlight="true" /> <!-- L-coin -->
	<item id="29647" count="3" /> <!-- Attendance Coin -->
	<item id="71437"/> <!-- Shining jewel box -->
	<item id="91780" count="3" /> <!-- Battle scroll  -->
	<item id="29566"/> <!-- Attendance XP Rune -->
	<item id="29650" count="3" /> <!-- XP/SP Scroll - High -->
	<item id="10649" count="3" /> <!-- Feather of blessing -->
	<item id="90045" count="31" highlight="true"/> <!-- L-coin -->
	<item id="29647" count="3" /> <!-- Attendance Coin -->
	<item id="71437" count="2" /> <!-- Shining jewel box -->
	<item id="91780" count="6" /> <!-- Battle scroll  -->
	<item id="29566" count="2" /> <!-- Attendance XP Rune -->
	<item id="29650" count="6" /> <!-- XP/SP Scroll - High -->
	<item id="10649" count="4" /> <!-- Feather of blessing -->
	<item id="90045" count="31" highlight="true" /> <!-- L-coin -->
	<item id="29647" count="3" /> <!-- Attendance Coin -->
	<item id="71437" count="2" /> <!-- Shining jewel box -->
	<item id="91780" count="6" /> <!-- Battle scroll  -->
	<item id="29566" count="2" /> <!-- Attendance XP Rune -->
	<item id="29650" count="6" /> <!-- XP/SP Scrolsssl - High -->
	<item id="10649" count="5" /> <!-- Feather of blessing -->
	<item id="90045" count="31" highlight="true"/> <!-- L-coin -->

	<vip-item id="57" count="1000" vip-level="1"/>
	<vip-item id="57" count="10000" vip-level="2"/>
	<vip-item id="57" count="100000" vip-level="3"/>
	<vip-item id="57" count="1000000" vip-level="4"/>
</list>